{
  "schema_version": "1.0.0",
  "release": "1.0.0-rc.1",
  "decision": "HOLD",
  "gates": [
    {
      "gate_id": "critical_claim_sweep",
      "status": "pending",
      "evidence": [
        "registry/GATE_MIGRATIONS.md",
        "registry/clinical_claims.jsonl"
      ],
      "notes": "O registry cobre sentinelas recuperadas, mas nao certifica varredura independente de todas as 105 capsulas de alto risco (denominador conforme artifacts/METRICS.json capsules.by_risk.high). Nota anterior citava 103 (stale). Gate permanece pending."
    },
    {
      "gate_id": "p0_zero",
      "status": "pending",
      "evidence": [
        "references/CLINICAL_CLAIM_REVIEW.md"
      ],
      "notes": "Correções sentinela existem; fechamento P0 integral ainda não foi adjudicado."
    },
    {
      "gate_id": "p1_high_risk_zero",
      "status": "pending",
      "evidence": [
        "references/CLINICAL_CLAIM_REVIEW.md"
      ],
      "notes": "Pendências/quarentenas são honestas, mas o gate global não foi certificado."
    },
    {
      "gate_id": "behavioral_sentinels_3_of_3",
      "status": "pending",
      "evidence": [
        "qualification/fixtures/behavioral/MANIFEST.json",
        "qualification/reports/BEHAVIORAL_QUALIFICATION_REPORT.md",
        "qualification/reports/BEHAVIORAL_SURFACE_MATRIX.md",
        "qualification/runs/behavioral/",
        "qualification/runs/behavioral_codex/",
        "references/EVALUATION_SUITE.md"
      ],
      "notes": "Denominadores permanecem separados por superficie. Claude preserva: T05 historico FAIL apos fixture canonica 3/3, reparo textual 1 em 1/3 e reparo textual 2 em 0/3; T08 PASS 3/3; T09 PASS 3/3; T10 INCONCLUSIVE por ConnectionRefused e OAuth expirado. No Codex: T05 estrutural PASS 3/3; T08 e T09 PASS 1/1; T10 reparado PASS 3/3; T12, T15, T16, T17 e T23 PASS; T20, T21 e T22 materializados PASS 3/3; T01 reparo de escopo real PASS 3/3; T02 PASS 3/3; T03 PASS 3/3 contrastes A/B; T04 clean reexecution PASS 3/3; T06 PASS 3/3; T07 PASS 3/3; T13 reparo PASS 3/3; T14 reparo PASS 3/3; T18 PASS 3/3; T19 reparado PASS 3/3 após declarar a proveniência sintética no payload. Os T01, T13, T14 e T19 historicos FAIL permanecem preservados fora dos denominadores reparados e a rodada core nao substitui os testes ainda nao executados. As tentativas minimas anteriores permanecem preservadas fora do denominador materializado; T22 tambem preserva uma tentativa de caminho sibling e uma divergencia raw/estado como INCONCLUSIVE. O gate permanece pending por lacunas restantes; nenhum resultado Codex e transferido para Claude. Ver qualification/reports/BEHAVIORAL_SURFACE_MATRIX.md."
    },
    {
      "gate_id": "behavioral_core_2_of_3",
      "status": "pending",
      "evidence": [
        "references/EVALUATION_SUITE.md"
      ],
      "notes": "T01 reparo de escopo real, T02, T03, T04, T06, T07, T13, T14, T18 e T19 passaram nos runs Codex limpos registrados, mas isso é apenas a tranche inicial do core; contratos e testes unitários não substituem os runs comportamentais restantes."
    },
    {
      "gate_id": "longitudinal_resume_end_to_end",
      "status": "pending",
      "evidence": [
        "scripts/ledger.py",
        "tests/test_ledger.py"
      ],
      "notes": "Unidades determinísticas e E2E local do ledger passam; retomada através da superfície real em duas sessões headless ainda não foi demonstrada. Ver qualification/reports/LONGITUDINAL_E2E_REPORT.md."
    },
    {
      "gate_id": "scripted_user_journeys",
      "status": "pending",
      "evidence": [
        "registry/GATE_MIGRATIONS.md"
      ],
      "notes": "Substitui pilot_5_to_8_students_48h por decisao explicita do usuario; o gate retirado esta registrado como superseded em registry/GATE_MIGRATIONS.md e nunca foi executado nem aprovado. Fecha somente com jornadas sinteticas ponta a ponta em sessoes limpas, com fixtures congeladas, transcricoes, repeticoes e adjudicacao objetiva. A tentativa T10 foi somente ConnectionRefused e permanece inconclusiva; ver qualification/reports/BEHAVIORAL_EXECUTION_BLOCKER.md. Nao equivale a estudo de usabilidade humano."
    },
    {
      "gate_id": "clean_install",
      "status": "pending",
      "evidence": [
        "README_INSTALL.md",
        "COMPATIBILITY.md"
      ],
      "notes": "A instalação descartável v3 (commit local 16b492f) passou 20/20 testes e reconciliação 158; a qualificação Codex de T10 agora tem três execuções limpas válidas, mas validate mantém error=2 por dois conflitos clínicos de alto risco e o gate permanece pending porque a suíte comportamental e os gates clínicos ainda não foram fechados. Ver qualification/reports/CLEAN_INSTALL_REPORT.md."
    }
  ]
}
